{
  "concept_id": "integ.definite-apps",
  "name": "Applications of Definite Integrals",
  "track": "BOTH",
  "one_liner": "Using integrals to compute area between curves, average value, and net displacement.",
  "prerequisites": [
    "integ.substitution"
  ],
  "explanations": [
    {
      "tier": "novice",
      "framing_index": 0,
      "body_md": "You already know how to find the area under a single curve. Now imagine two curves on the same graph, and you want the area of the region trapped between them.\n\nHere is the key idea: at each $x$-value, you measure the vertical gap between the two curves. The curve on top minus the curve on the bottom gives you that gap. Then you add up all those tiny gaps from left to right — that is the integral.\n\nLet's make it concrete. Suppose $f(x) = x + 2$ and $g(x) = x^2$. First, find where they meet by solving $x + 2 = x^2$. Rearranging: $x^2 - x - 2 = 0$, which factors as $(x-2)(x+1) = 0$. So the curves cross at $x = -1$ and $x = 2$.\n\nNext, figure out which curve is on top between those two $x$-values. Plug in an easy point, say $x = 0$: $f(0) = 2$ and $g(0) = 0$. Since $f(0) > g(0)$, the line $f(x)$ is the upper curve and $g(x)$ is the lower curve on $[-1, 2]$.\n\nNow set up the integral — upper minus lower:\n\n$$\\text{Area} = \\int_{-1}^{2} \\bigl[(x+2) - x^2\\bigr]\\, dx$$\n\nSimplify the inside: $-x^2 + x + 2$. Find the antiderivative:\n\n$$-\\frac{x^3}{3} + \\frac{x^2}{2} + 2x$$\n\nEvaluate from $-1$ to $2$:\n\nAt $x = 2$: $-\\frac{8}{3} + 2 + 4 = \\frac{10}{3}$.\n\nAt $x = -1$: $\\frac{1}{3} + \\frac{1}{2} - 2 = -\\frac{7}{6}$.\n\nSubtract: $\\frac{10}{3} - \\bigl(-\\frac{7}{6}\\bigr) = \\frac{20}{6} + \\frac{7}{6} = \\frac{27}{6} = \\frac{9}{2}$.\n\nSo the area between the curves is $\\frac{9}{2}$ square units.\n\nQuick recipe to remember:\n1. Find the intersection points (your limits of integration).\n2. Determine which function is on top.\n3. Integrate (top $-$ bottom).\n4. Evaluate.",
      "intuition_md": "Think of the two curves as the outlines of a sandwich viewed from the side. At every spot along the sandwich, the thickness is the distance from the top slice of bread to the bottom slice. If you could measure that thickness at every single point from the left end to the right end and add all those measurements together, you would get the total area of the filling in between. That is exactly what $\\int (f - g)\\, dx$ does: it sweeps from left to right, stacking up all those tiny vertical thickness measurements into one total area."
    },
    {
      "tier": "novice",
      "framing_index": 1,
      "body_md": "Imagine you're walking along a straight road. Sometimes you walk forward, sometimes you walk backward.\n\nLet's say your velocity (speed with a direction) is given by $v(t) = t - 2$, measured in meters per second, from $t = 0$ to $t = 4$ seconds.\n\nNotice something: from $t = 0$ to $t = 2$, the velocity is negative (you're walking backward). From $t = 2$ to $t = 4$, it's positive (you're walking forward).\n\n**Net displacement** answers: \"How far are you from where you started?\" To find it, you compute the integral straight up:\n\n$$\\text{Net displacement} = \\int_0^4 v(t)\\, dt = \\int_0^4 (t - 2)\\, dt$$\n\nWorking this out: $\\frac{t^2}{2} - 2t$ evaluated from $0$ to $4$ gives $(8 - 8) - (0 - 0) = 0$.\n\nZero. You ended up right where you started. The backward walking cancelled the forward walking.\n\n**Total distance** answers a different question: \"How many meters did your legs actually cover?\" Backward steps still count as real steps. To get this, you integrate the absolute value of velocity:\n\n$$\\text{Total distance} = \\int_0^4 |v(t)|\\, dt = \\int_0^4 |t - 2|\\, dt$$\n\nSince $v(t)$ is negative on $[0, 2]$ and positive on $[2, 4]$, you split the integral:\n\n$$\\int_0^2 -(t-2)\\, dt + \\int_2^4 (t-2)\\, dt$$\n\nThe first piece equals $2$, the second equals $2$. Total distance $= 4$ meters.\n\nSo the key rule:\n\n- $\\int v\\, dt$ gives **net displacement** (positive and negative parts can cancel).\n- $\\int |v|\\, dt$ gives **total distance** (everything counts as positive).\n\nThe tricky part is finding where $v(t)$ changes sign. Set $v(t) = 0$, solve, and split your integral there. You already know substitution, so the actual integration isn't the hard part — it's remembering to split correctly.",
      "intuition_md": "Think of a car's trip odometer versus its GPS. The trip odometer goes up no matter which direction you drive — it tracks total distance. The GPS only cares about where you are relative to where you started — that's net displacement. If you drive 3 miles north and then 3 miles south, your GPS says you moved 0 miles (net displacement), but your odometer reads 6 miles (total distance). The absolute value inside the integral is like switching your calculation from \"GPS mode\" to \"odometer mode.\" It forces every bit of motion to count as positive."
    },
    {
      "tier": "on_pace",
      "framing_index": 0,
      "body_md": "You already know how to evaluate a definite integral — now the question is *what can you do with one?* The answer: measure things that accumulate.\n\n**Area between curves.** If $f(x) \\ge g(x)$ on $[a, b]$, the area trapped between them is\n$$A = \\int_a^b \\bigl[f(x) - g(x)\\bigr]\\,dx.$$\nThe integrand is always \"top minus bottom.\" If the curves swap positions, you need to split at the crossing point or use $|f(x) - g(x)|$.\n\n**Average value.** The average value of $f$ on $[a,b]$ is\n$$f_{\\text{avg}} = \\frac{1}{b-a}\\int_a^b f(x)\\,dx.$$\nThink of it as spreading the total accumulation evenly across the interval.\n\n**Net displacement vs. total distance.** For a velocity function $v(t)$:\n- Net displacement: $\\int_a^b v(t)\\,dt$ (signed; negative velocity subtracts).\n- Total distance traveled: $\\int_a^b |v(t)|\\,dt$ (always positive; you split at zeros of $v$).\n\n**Volumes of revolution** (BC and some AB curricula). Rotate a region around an axis and stack cross-sections:\n- Disk method: $V = \\pi\\int_a^b [R(x)]^2\\,dx$ when the region touches the axis.\n- Washer method: $V = \\pi\\int_a^b \\bigl([R(x)]^2 - [r(x)]^2\\bigr)\\,dx$ when there is a hole.\n\n**Common sticking points:**\n1. Forgetting to find intersection points — they define your limits $a$ and $b$.\n2. Confusing net displacement with total distance. If $v(t)$ changes sign, a plain integral gives net displacement, not miles on the odometer.\n3. In washers, the radii $R$ and $r$ are measured from the axis of rotation, which isn't always the $x$-axis.\n\nAll of these applications rest on one idea: slice something complicated into thin pieces, approximate each piece, then let the integral add them up exactly. You've been doing that since Riemann sums — this is just the payoff.",
      "intuition_md": "Picture filling a bathtub with a hose whose flow rate changes over time. The definite integral of the flow rate gives you the total water in the tub — that's accumulation. Now imagine the water level rises and falls because someone also opens the drain. The integral of the net flow tells you how much water is in the tub at the end (net change), while integrating the absolute value of each flow tells you the total volume of water that *moved* through the system. Every application — area, distance, volume — is just a version of adding up thin slices of something that varies."
    },
    {
      "tier": "advanced",
      "framing_index": 0,
      "body_md": "The definite integral $\\int_a^b f(x)\\,dx$ computes a **signed accumulation**. Most applications reduce to one meta-theorem:\n\n> If a quantity $Q$ changes at rate $f(t)$, then the net change over $[a,b]$ is $Q(b)-Q(a)=\\int_a^b f(t)\\,dt$.\n\nThis is just the Fundamental Theorem of Calculus (FTC), but recognizing it as the *engine* behind every application keeps things unified.\n\n**Area between curves.** If $f(x)\\ge g(x)$ on $[a,b]$, the area is\n$$A=\\int_a^b [f(x)-g(x)]\\,dx.$$\nWhy? Each infinitesimal vertical strip has height $f(x)-g(x)$ and width $dx$. You're summing those strips — the Riemann-sum limit makes this rigorous.\n\n**Average value.** The average of $f$ on $[a,b]$ is\n$$f_{\\text{avg}}=\\frac{1}{b-a}\\int_a^b f(x)\\,dx.$$\nThis generalizes the discrete mean: replace summation with integration, and the count $n$ with the interval length $b-a$. The Mean Value Theorem for Integrals guarantees some $c\\in(a,b)$ where $f(c)=f_{\\text{avg}}$, provided $f$ is continuous — a direct consequence of the Intermediate Value Theorem applied to $F'(x)=f(x)$.\n\n**Accumulation functions.** Define $F(x)=\\int_a^x f(t)\\,dt$. By FTC Part 1, $F'(x)=f(x)$. This lets you analyze net change even when you have no closed-form antiderivative — you reason about $F$ using the sign and magnitude of $f$. Concavity of $F$ comes from $F''=f'$, linking back to the derivative tests you already know.\n\n**Displacement vs. distance.** For velocity $v(t)$:\n- Net displacement $= \\int_a^b v(t)\\,dt$ (signed).\n- Total distance $= \\int_a^b |v(t)|\\,dt$ (unsigned).\n\nThe absolute value forces you to split at zeros of $v$ — an application of the additive interval property of integrals.\n\n**Stretch question.** Suppose $f$ is continuous on $[0,1]$ with $\\int_0^1 f(x)\\,dx=0$ and $f$ is not identically zero. Prove that $f$ must change sign on $(0,1)$. What theorem(s) do you invoke, and where does continuity matter?",